{
  "protocol": {
    "name": "Semantic UI Evolution Design Protocol",
    "version": "0.1.0",
    "compatibility": {
      "minTransformContractVersion": "1.0.0",
      "stateModelVersion": "0.1.0"
    }
  },
  "semanticRoles": {
    "screen": { "kind": "container", "purpose": "Root semantic UX workspace." },
    "feature": { "kind": "container", "purpose": "Independently evolving UX capability." },
    "left_navigation": { "kind": "region", "purpose": "Fixed sidebar/minibar navigation block." },
    "right_workspace": { "kind": "region", "purpose": "Main screen workspace to the right of navigation." },
    "breadcrumbs_region": { "kind": "region", "purpose": "Top right workspace region that always renders breadcrumbs." },
    "content_area": { "kind": "region", "purpose": "Lower right workspace region for contextual screen content." },
    "primary_content": { "kind": "region", "purpose": "Main workflow area inside the content area." },
    "table_controls": { "kind": "node", "purpose": "Controls above a table with left search/filter group and right actions group." },
    "table_controls_left": { "kind": "node", "purpose": "Left side of table controls: search first, then filters." },
    "table_controls_right": { "kind": "node", "purpose": "Right side of table controls: CTA on the far right, secondary outline actions to the left." },
    "table_pagination": { "kind": "node", "purpose": "Pagination block rendered below the table." },
    "persistent_filters": { "kind": "region", "purpose": "Visible filtering controls inside table controls." },
    "contextual_drawer": { "kind": "region", "purpose": "Contextual details overlay." },
    "toolbar": { "kind": "node", "purpose": "Action and control surface." },
    "filters": { "kind": "node", "purpose": "Filter control group." },
    "primary_filter": { "kind": "node", "purpose": "High-priority search or filtering control." },
    "secondary_controls": { "kind": "node", "purpose": "Lower-priority controls that can be collapsed or reduced." },
    "data_table": { "kind": "widget", "purpose": "Dense operational data display." },
    "data_display": { "kind": "widget", "purpose": "Structured or metric data presentation." },
    "details_overlay": { "kind": "widget", "purpose": "Contextual detail view." },
    "form_input": { "kind": "node", "purpose": "User-editable field group." },
    "metric_summary": { "kind": "widget", "purpose": "Compact summary of metrics." },
    "tabs_region": { "kind": "region", "purpose": "Semantic grouping via switchable views." },
    "navigation_item": { "kind": "node", "purpose": "Sidebar/minibar navigation item." },
    "navigation_toggle": { "kind": "node", "purpose": "Sidebar/minibar collapse or expand control." },
    "primary_cta": { "kind": "node", "purpose": "Main contextual action, positioned far right in table controls." },
    "secondary_action": { "kind": "node", "purpose": "Secondary outline action positioned left of the primary CTA." },
    "missing_capability": { "kind": "widget", "purpose": "Placeholder preserving unsupported semantic intent." }
  },
  "layoutSemantics": {
    "full_screen_layout": {
      "description": "Root wrapper with 24px outer padding and two blocks: fixed collapsible left sidebar/minibar and right workspace.",
      "spacing": { "outerPaddingPx": 24, "innerGapPx": 16 },
      "structure": ["left_navigation", "right_workspace"]
    },
    "right_workspace": {
      "description": "Right block split vertically into breadcrumbs region and contextual content area.",
      "spacing": { "innerGapPx": 16 },
      "structure": ["breadcrumbs_region", "content_area"]
    },
    "left_navigation": {
      "description": "Fixed sidebar/minibar navigation. It may collapse but remains present.",
      "compatibleWidgets": ["SidebarMinibar", "MissingCapabilityWidget"]
    },
    "breadcrumbs_region": {
      "description": "Always-visible breadcrumb region at the top of the right workspace.",
      "compatibleWidgets": ["Breadcrumbs", "MissingCapabilityWidget"]
    },
    "content_area": {
      "description": "Main contextual area below breadcrumbs.",
      "compatibleWidgets": ["DataTable", "Form", "StatsCards", "Tabs", "TableControls", "MissingCapabilityWidget"]
    },
    "primary_content": {
      "description": "Dominant workflow region.",
      "compatibleWidgets": ["DataTable", "Form", "StatsCards", "Tabs", "MissingCapabilityWidget"]
    },
    "persistent_filters": {
      "description": "Visible filtering controls inside the left side of TableControls.",
      "compatibleWidgets": ["TableControls", "MissingCapabilityWidget"]
    },
    "contextual_drawer": {
      "description": "Right-side modal drawer that opens from the right and spans full viewport height.",
      "compatibleWidgets": ["Drawer", "Form", "MissingCapabilityWidget"]
    },
    "toolbar": {
      "description": "Compact control strip for primary and secondary actions.",
      "compatibleWidgets": ["TableControls", "Tabs", "MissingCapabilityWidget"]
    },
    "tabs_region": {
      "description": "Switchable semantic grouping of related views.",
      "compatibleWidgets": ["Tabs", "DataTable", "StatsCards", "MissingCapabilityWidget"]
    }
  },
  "screenArchetypes": {
    "crud_management": {
      "description": "Manage entities with search, filters, table, details and edit flows.",
      "preferredWidgets": ["SidebarMinibar", "Breadcrumbs", "TableControls", "DataTable", "Drawer", "Form"],
      "discouragedWidgets": ["StatsCards"],
      "layoutPreferences": ["full_screen_layout", "left_navigation", "breadcrumbs_region", "content_area", "primary_content", "contextual_drawer"]
    },
    "dense_operational": {
      "description": "High-speed operational workflow with dense data and persistent controls.",
      "preferredWidgets": ["SidebarMinibar", "Breadcrumbs", "TableControls", "DataTable", "Drawer", "Tabs"],
      "discouragedWidgets": ["StatsCards"],
      "layoutPreferences": ["full_screen_layout", "left_navigation", "breadcrumbs_region", "content_area", "toolbar", "primary_content"],
      "rules": {
        "allowSidebarFilters": false,
        "preferCompactVariants": true
      }
    },
    "approval_workflow": {
      "description": "Review and approve structured changes with context and history.",
      "preferredWidgets": ["SidebarMinibar", "Breadcrumbs", "Drawer", "Form", "Tabs", "DataTable"],
      "discouragedWidgets": [],
      "layoutPreferences": ["full_screen_layout", "left_navigation", "breadcrumbs_region", "content_area", "primary_content", "contextual_drawer", "tabs_region"]
    }
  },
  "widgetDefinitions": [
    {
      "widgetType": "AppLayout",
      "purpose": "Full screen wrapper with fixed collapsible left sidebar/minibar and right workspace.",
      "supportedInteractions": ["sidebar_collapse", "workspace_navigation", "semantic_region_selection"],
      "variants": ["standard"],
      "defaultVariant": "standard",
      "semanticNodes": [
        { "suffix": "left_navigation", "role": "left_navigation", "targetable": true },
        { "suffix": "right_workspace", "role": "right_workspace", "targetable": true },
        { "suffix": "breadcrumbs", "role": "breadcrumbs_region", "targetable": true },
        { "suffix": "content", "role": "content_area", "targetable": true }
      ],
      "allowedTransforms": ["switch_widget_variant", "reduce_visual_weight"],
      "constraints": ["Outer wrapper padding is 24px.", "Inner gaps are 16px.", "Right workspace is always split into breadcrumbs and content area."],
      "discouragedUsage": ["Rendering screens without breadcrumbs in the right workspace."],
      "rendererContract": "Render a full-screen shell with left navigation and right workspace regions, exposing semantic anchors for all regions.",
      "explainability": { "summary": "AppLayout provides the stable screen geometry for semantic rendering." }
    },
    {
      "widgetType": "SidebarMinibar",
      "purpose": "Fixed collapsible left navigation block.",
      "supportedInteractions": ["collapse_expand", "subsystem_switching", "theme_switching", "navigation", "badges"],
      "variants": ["standard", "short"],
      "defaultVariant": "standard",
      "semanticNodes": [
        { "suffix": "items", "role": "navigation_item", "targetable": true },
        { "suffix": "toggle", "role": "navigation_toggle", "targetable": true }
      ],
      "allowedTransforms": ["switch_widget_variant", "reduce_visual_weight"],
      "constraints": ["Sidebar/minibar is fixed and remains present when collapsed.", "Collapsed mode maps to short layout mode."],
      "discouragedUsage": ["Using as contextual table filters or screen content."],
      "rendererContract": "Bind to CombinedNavMenu and expose anchors for navigation items and collapse toggle.",
      "explainability": { "summary": "SidebarMinibar maps platform navigation to the existing collapsible UIKit navigation." }
    },
    {
      "widgetType": "Breadcrumbs",
      "purpose": "Always-visible top breadcrumb region in the right workspace.",
      "supportedInteractions": ["breadcrumb_navigation"],
      "variants": ["standard"],
      "defaultVariant": "standard",
      "semanticNodes": [
        { "suffix": "items", "role": "breadcrumbs_region", "targetable": true }
      ],
      "allowedTransforms": ["reduce_visual_weight"],
      "constraints": ["Breadcrumbs are always rendered in the top right workspace region."],
      "discouragedUsage": ["Hiding breadcrumbs on regular screens."],
      "rendererContract": "Bind to BreadCrumbs or GenomeBreadCrumbs and expose breadcrumb semantic anchors.",
      "explainability": { "summary": "Breadcrumbs preserve navigation context for every screen." }
    },
    {
      "widgetType": "DataTable",
      "purpose": "Dense operational display for structured entities.",
      "supportedInteractions": ["sorting", "filtering", "grouping", "pagination", "selection", "density_modes", "column_visibility"],